Ano;Programa;Identificador_Unico;Descricao;Unidade_Medida;Periodicidade;Base_Geografica;Fonte;Fórmula_Calculo;Valor_Referencia;Data_Referencia;Valor_Final_PPA;Valor_Previsto_no_Ano;Periodo_01;Periodo_02;Periodo_03;Periodo_04;Periodo_05;Periodo_06;Periodo_07;Periodo_08;Periodo_09;Periodo_10;Periodo_11;Periodo_12;Comentarios
2010;286;1925;Volume de Óleo Derramado - VOD;m³;Anual;Nacional;Petrobrás;Somatório do volume de óleo derramado proveniente de acidentes.;49.0;2003.0;0.0;39.0;276.4;0.0;0.0;0.0;0.0;0.0;0.0;0.0;0.0;0.0;0.0;0.0;"Embora o volume derramado em 2010 (276,40 m3) pareça sugerir aumento relativo dos volumes médios dos incidentes, verifica-se que esse volume foi em grande parte influenciado por ocorrências isoladas, em diferentes instalações e operadas por diferentes equipes, evidenciando que não se tratam de incidentes sistêmicos, ainda que mereçam toda atenção:

 - três ocorrências em datas próximas, em um mesmo trecho de oleoduto terrestre (250 m3) decorrentes de corrosão profunda e extensa ao longo da geratriz inferior na Zona Termicamente Afetada (ZTA) da costura do tubo, em Guamaré-RN;
 - um incidente decorrente de descontrole em processo de tratamento de água produzida na P-48 em março/2010 (20 m3); 
 - um incidente decorrente de desconexão de mangote de transferência na P-47 em junho/2010 (1,58 m3)
 - um incidente decorrente de descontrole em processo de tratamento de água produzida na P-43 em outubro/2010 (1,80 m3).

Todos os demais incidentes foram de pequena monta, totalizando 5,10 m3, que correspondem a menos de 50 litros por incidente.

A esta mesma conclusão chegou a International Associacion of Oil & Gas Producers  OGP que, na página três de seu relatório anual de indicadores ambientais de 2009 conclui: Spill volumes are usually dominated by a few incidents (OGP, Environmental performance in the E&P industry - 2009 data  Report 442).

Excluídas as ocorrências acima destacadas, que podem ser consideradas pontos fora da curva, verifica-se que o desempenho da atividade apresenta desempenho com tendência de queda no volume de óleo derramado quando analisado período maior (últimos dez anos) e de estabilidade, quando considerados os últimos três anos, com resultado significativamente melhor que as demais empresas-membro da OGP."
2010;286;297;Produção Média de Óleo e Líquido de Gás Natural;Mil barris por dia;Anual;Nacional;Petrobras;Relação entre o somatório da produção de óleo e líquido de gás natural dos campos e o número de dias do ano.;1540.0;2003.0;0.0;2430.0;2004.0;0.0;0.0;0.0;0.0;0.0;0.0;0.0;0.0;0.0;0.0;0.0;"A Petrobras iniciou, em março de 2010, o TLD das áreas de Tiro e Sidon, com a instalação da plataforma semissubmersível SS-11 Atlantic Zephyr, cuja capacidade de produção de óleo é de 20 mil bpd e a de tratamento de gás é de 475.720 m3/dia. As jazidas estão localizadas no bloco exploratório BM-S-40 (100% Petrobras), na região sul da Bacia de Santos, a cerca de 210 km da costa. O TLD será feito em duas etapas: produção no poço 1-SPS-56, na acumulação de Tiro, por um período de 12 meses, e teste do poço 1-SPS-57, na área de Sidon, por igual período.

Em maio, foi iniciada a produção do FPSO Capixaba, no campo de Cachalote. Em julho, o FPSO foi conectado também ao campo de Baleia Franca, ambos no Parque das Baleias, no litoral sul do Espírito Santo, na Bacia de Campos. O FPSO tem capacidade para processar 100 mil bpd de óleo e 3,2 milhões de m³/dia de gás.

Além do início da produção do campo de Baleia Franca, no segundo semestre de 2010, foram iniciadas as operações de quatro novas plataformas. Em julho, entrou em produção o FPSO Cidade de Santos, para o desenvolvimento dos campos de Uruguá e Tambaú. Trata-se do primeiro FPSO instalado para o desenvolvimento definitivo de dois campos de petróleo e gás da Bacia de Santos. O navio está ancorado a 160 km da costa de São Paulo, com lâmina dágua de 1.300 m, e tem capacidade para produzir 10 milhões de m³/dia de gás natural e 35 mil bpd de óleo.

Em outubro, foi iniciada a operação do navio-plataforma Cidade de Angra dos Reis, a primeira unidade programada para produzir em escala comercial no Pré-Sal da Bacia de Santos, na área de Lula. Este sistema piloto complementará os dados técnicos colhidos pelo TLD iniciado em 2009, com informações relevantes sobre o reservatório e a produção, indispensáveis à concepção das futuras unidades que irão operar no Pré-Sal. A área de Lula é operada pela Petrobras (65%), em parceria com as empresas BG Group (25%) e Galp Energia (10%).

Em dezembro, a Petrobras iniciou a produção no campo de Jubarte, na Bacia de Campos, com a plataforma P-57, a 80 km da costa do Espírito Santo. A plataforma está ancorada em lâmina dágua de 1.260 m e tem capacidade para processar 180 mil bpd de óleo e 2 milhões de m³/dia de gás. Essa unidade inaugura uma nova geração de plataformas, concebidas a partir do conceito de engenharia que privilegia a simplificação de projetos e a padronização de equipamentos.

No mesmo mês, foi iniciado o TLD de Guará, no bloco exploratório BM-S-9 da Bacia de Santos, a cerca de 310 km da costa de São Paulo e a 55 km a sudoeste do campo de Lula. A plataforma Dynamic Producer foi instalada em lâmina dágua de 2.140 m. A Petrobras é a operadora (45%), em parceria com as empresas BG Group (30%) e Repsol (25%).

Esses projetos, aliados ao aumento de produção após a interligação de novos poços em diversas plataformas (P-53, P-51, P-34, FPSO Cidade de Vitória, FPSO Espírito Santo e FPSO Frade), compensaram o declínio natural da produção e ainda garantiram à companhia um aumento de 1,7% na produção nacional de óleo e LGN, que atingiu 2.004 mil bpd."
2010;286;298;Produção Média de Gás Natural;milhão de m³ por dia;Anual;Nacional;Petrobras;Relação entre o somatório da produção de gás natural dos campos, excluída a parcela liqüefeita (LGN),  e o número de dias no ano.;39.83;2003.0;0.0;94.1;53.08;0.0;0.0;0.0;0.0;0.0;0.0;0.0;0.0;0.0;0.0;0.0;"A produção de gás natural em 2010 totalizou 53,1 milhões de m³/dia, um incremento em relação ao ano anterior decorrente do aumento da demanda, principalmente no segundo semestre.
A oferta no Brasil cresceu em relação a 2009, devido principalmente à entrada em operação de novos projetos previstos no Plano de Antecipação da Produção de Gás (Plangás), como a antecipação da produção de gás do campo de Canapu e o aumento da produção do campo de Camarupim, no Espírito Santo. Além disso, o início das operações de processamento na Unidade de Tratamento de Gás (UTG) Sul Capixaba permitiu o escoamento da produção proveniente do Parque das Baleias, assim como o término da adequação da Unidade de Processamento de Gás da Refinaria Presidente Bernardes (RPBC) possibilitou o incremento da produção do campo de Lagosta, na Bacia de Santos. 
Em continuidade à implementação dos projetos previstos no Plangás, os campos de Mexilhão, Uruguá e Tambaú entrarão em produção em 2011. Nesse mesmo ano, a produção do campo de Lula começará a ser escoada, o que confirmará a trajetória ascendente da oferta de gás para o atendimento à demanda do mercado."
2010;286;711;Taxa de Frequência de Acidentados com Afastamento - TFCA;PERCENTAGEM;Anual;Nacional;Petrobras;Relação percentual entre o nº de empregados, próprios e de empresas contratadas das Unidades de Negócios do E&P, acidentados com afastamento, no período, multiplicado por 1.000.000, e o nº de horas-homem de exposição a risco de empregados próprios e de empresas contratadas.;1.2;2003.0;0.0;0.49;0.55;0.0;0.0;0.0;0.0;0.0;0.0;0.0;0.0;0.0;0.0;0.0;
2010;288;1705;Capacidade de Refino Instalada;Milhão de barris de petróleo por dia;Anual;Nacional;Petrobras;Capacidade potencial total anual de processamento, em milhões de barris, dividida pelo número de dias do ano.;1.83;2002.0;0.0;0.0;1.99;0.0;0.0;0.0;0.0;0.0;0.0;0.0;0.0;0.0;0.0;0.0;"O Índice Previsto para = 1,990.

Em 2010 a Capacidade de Refino Instalada ficou dentro do previsto para o ano."
2010;288;301;Capacidade de Processamento de Petróleo Anual Total;Milhão de barris de petróleo por dia;Anual;Nacional;Petrobras;Quantidade de petróleo total processada no ano, incluindo petróleo Nacional e importado.;1.62;2002.0;0.0;0.0;1.8;0.0;0.0;0.0;0.0;0.0;0.0;0.0;0.0;0.0;0.0;0.0;"O Índice Previsto para 2010 de Janeiro a Dezembro = 1.825.

Em 2010 o volume total de petróleo processado ficou abaixo do previsto para o ano. O fator que mais impactou, o desempenho do indicador foi:

a) Limitação de carga nas unidades em algumas Refinarias em função de indicação logística para adequação ao mercado."
2010;288;302;Capacidade de Processamento de Petróleo Nacional;Milhão de barris de petróleo por dia;Anual;Nacional;Petrobras;Somatório da quantidade média diária de petróleo nacional processada no ano.;1.26;2002.0;0.0;0.0;1.47;0.0;0.0;0.0;0.0;0.0;0.0;0.0;0.0;0.0;0.0;0.0;"O Índice Previsto para 2010 de Janeiro a Dezembro = 1.492.

Em 2010 o processamento de petróleo nacional ficou abaixo do previsto para o ano principalmente em função do seguinte fator:

a) Necessidade de aumento da participação de petróleo leve importado a fim de elevar a produção de diesel com menor teor de enxofre."
2010;290;2873;Extensão da malha de oleodutos de transporte da Petrobras;km;Anual;Nacional;Petrobras Transporte;Somatório da extensão dos oleodutos de transporte da Petrobras, em km.;7011.0;1996.0;0.0;0.0;7179.0;0.0;0.0;0.0;0.0;0.0;0.0;0.0;0.0;0.0;0.0;0.0;Não Informado
2010;290;2932;Capacidade Máxima de Movimentação dos Dutos Longos da Petrobras;milhão de m³ por dia;Anual;Nacional;Petrobras Transportes S.A. - Transpetro;Média do volume total diário de gás natural transportada.;10.05;2006.0;0.0;0.0;11.47;0.0;0.0;0.0;0.0;0.0;0.0;0.0;0.0;0.0;0.0;0.0;Não Informado
2010;290;307;Taxa de Participação da Frota de Navios Próprios da Petrobras no Transporte de Petróleo e Derivados;PERCENTAGEM;Anual;Nacional;Petrobras;Relação percentual entre o porte total médio no período dos navios próprios (em TPB) e o porte total médio no período dos navios utilizados pelo Sistema Petrobras no transporte de petróleo e derivados.;48.0;2002.0;0.0;0.0;29.0;0.0;0.0;0.0;0.0;0.0;0.0;0.0;0.0;0.0;0.0;0.0;Não Informado
2010;294;2667;Acréscimo de Capacidade Instalada de Geração de Energia Elétrica;MW;Anual;Regional;CMSE - Comitê de Monitoramento do Setor Elétrico;ampliação anual da capacidade instalada em novas usinas e/ou unidades de geração de energia elétrica.;89.0;2007.0;0.0;350.0;433.8;0.0;0.0;0.0;0.0;0.0;0.0;0.0;0.0;0.0;0.0;0.0;Não Informado
2010;294;2668;Acréscimo de Linhas de Transmissão de Energia Elétrica com Tensão Igual ou Superior a 230 KV;km;Anual;Regional;CMSE - Comitê de Monitoramento do Setor Elétrico;ampliação anual das linhas de transmissão de energia elétrica com tensão igual ou superior a 230 kV.;220.0;2007.0;0.0;775.0;1262.0;0.0;0.0;0.0;0.0;0.0;0.0;0.0;0.0;0.0;0.0;0.0;Não Informado
2010;295;2669;Acréscimo de Capacidade Instalada de Geração de Energia Elétrica;MW;Anual;Regional;CMSE - Comitê de Monitoramento do Setor Elétrico;ampliação anual da capacidade instalada em novas usinas e/ou unidades de geração de energia elétrica;1855.0;2007.0;0.0;409.0;917.0;0.0;0.0;0.0;0.0;0.0;0.0;0.0;0.0;0.0;0.0;0.0;Não Informado
2010;295;2670;Acréscimo de Linhas de Transmissão de Energia Elétrica com Tensão Igual ou Superior a 230 KV;km;Anual;Regional;CMSE - Comitê de Monitoramento do Setor Elétrico;ampliação anual das linhas de transmissão de energia elétrica com tensão igual ou superior a 230 kV.;1090.0;2007.0;0.0;151.0;397.0;0.0;0.0;0.0;0.0;0.0;0.0;0.0;0.0;0.0;0.0;0.0;Não Informado
2010;296;2671;Acréscimo de Capacidade Instalada de Geração Elétrica;MW;Anual;Regional;CMSE - Comitê de Monitoramento do Setor Elétrico;ampliação anual da capacidade instalada em novas usinas e/ou unidades de geração de energia elétrica.;470.0;2007.0;0.0;280.0;2158.0;0.0;0.0;0.0;0.0;0.0;0.0;0.0;0.0;0.0;0.0;0.0;Não Informado
2010;296;2672;Acréscimo de Linhas de Transmissão de Energia Elétrica com Tensão Igual ou Superior a 230 KV;km;Anual;Regional;CMSE - Comitê de Monitoramento do Setor Elétrico;ampliação anual das linhas de transmissão de energia elétrica com tensão igual ou superior a 230 kV;200.0;2007.0;0.0;606.0;831.0;0.0;0.0;0.0;0.0;0.0;0.0;0.0;0.0;0.0;0.0;0.0;Não Informado
2010;297;2673;Acréscimo de Capacidade Instalada de Geração de Energia Elétrica;MW;Anual;Regional;CMSE - Comitê de Monitoramento do Setor Elétrico;ampliação anual da capacidade instalada em novas usinas e/ou unidades de geração de energia elétrica;1090.0;2007.0;0.0;1204.0;343.2;0.0;0.0;0.0;0.0;0.0;0.0;0.0;0.0;0.0;0.0;0.0;Não Informado
2010;297;2674;Acréscimo de Linhas de Transmissão de Energia Elétrica com Tensão Igual ou Superior a 230 Kv;km;Anual;Regional;CMSE - Comitê de Monitoramento do Setor Elétrico;ampliação anual das linhas de transmissão de energia elétrica com tensão igual ou superior a 230 kV;278.0;2007.0;0.0;0.0;1091.0;0.0;0.0;0.0;0.0;0.0;0.0;0.0;0.0;0.0;0.0;0.0;Não Informado
2010;350;972;Consumo Interno de Café;milhão de sacas;Anual;Nacional;Associação Brasileira da Indústria de Café - ABIC;Somatório do número de sacas destinadas ao (absorvidas pelo) mercado interno no ano.;13.6;2003.0;0.0;20.1;19.3;0.0;0.0;0.0;0.0;0.0;0.0;0.0;0.0;0.0;0.0;0.0;Conforme estimativas realizadas pela ABIC e ABICS, o consumo de café atingiu em 2010 o total de 19,3 milhões de sacas.
2010;350;973;Volume de Produção de Café;milhão de sacas;Anual;Nacional;Companhia Nacional de Abastecimento - CONAB;Somatório do total de sacas de café produzidas no ano.  Obs: A safra de café sofre efeito bianual em sua produção.;29.0;2003.0;0.0;38.8;48.09;0.0;0.0;0.0;0.0;0.0;0.0;0.0;0.0;0.0;0.0;0.0;Com base no 4º levantamento da Safra 2010 apresentado pela CONAB, a produção brasileira foi de 48,09 milhões de sacas de café.
2010;350;975;Volume de Exportação de Café;milhão de sacas;Anual;Nacional;MDIC - Secretaria de Comércio Exterior - SECEX;Somatório do número total de sacas de café negociadas com o exterior no ano.;17.3;2003.0;0.0;26.6;33.5;0.0;0.0;0.0;0.0;0.0;0.0;0.0;0.0;0.0;0.0;0.0;Conforme informações do MDIC/SECEX e da OIC, as exportações de café atingiram em 2010 o total de 33,5 milhões de sacas.
2010;351;1782;Taxa de Atendimento aos Beneficiários do Pronaf  Assentados da Reforma Agrária;PERCENTAGEM;Anual;Nacional;Ministério do Desenvolvimento Agrário;Relação percentual entre o nº de contratos linha A e o nº de famílias assentadas.;50.55;2003.0;0.0;85.0;63.16;0.0;0.0;0.0;0.0;0.0;0.0;0.0;0.0;0.0;0.0;0.0;
2010;351;1783;Taxa de Atendimento aos Beneficiários do Pronaf  Linha B;PERCENTAGEM;Anual;Nacional;Ministério do Desenvolvimento Agrário;Relação percentual entre o nº de contratos linha B e o nº de famílias de agricultores da categoria B.;17.0;2003.0;0.0;48.0;55.61;0.0;0.0;0.0;0.0;0.0;0.0;0.0;0.0;0.0;0.0;0.0;
2010;351;37;Taxa de Atendimento aos Beneficiários do Pronaf Linha V;PERCENTAGEM;Anual;Nacional;Dados do Banco Central do Brasil  RECOR;Relação percentual entre o número de operações contratadas e o número de agricultores familiares com valor bruto da produção entre R$ 5.000,00 e R$ 110.000,00 (limites estabelecidos pelo Conselho Monetário Nacional  ver Resolução 3559 combinada com Resolução 3570, transcrita no MCR Capítulo 10, seção 2, item 1.d.VI).;55.8;2007.0;0.0;62.38;61.01;0.0;0.0;0.0;0.0;0.0;0.0;0.0;0.0;0.0;0.0;0.0;
2010;352;2169;Margem de Disponibilidade de Algodão em Pluma;PERCENTAGEM;Anual;Nacional;Companhia Nacional de Abastecimento - CONAB;Relação percentual entre a quantidade estocada de algodão em pluma e o consumo aparente no ano de referência.;15.0;2003.0;0.0;59.0;16.0;0.0;0.0;0.0;0.0;0.0;0.0;0.0;0.0;0.0;0.0;0.0;A margem de disponibilidade de algodão apurada em 2010 foi de 16%, inferior à meta prevista (60%).Tal fato decorre, principalmente, da redução na produção nacional e do aumento do consumo interno, devido à melhoria do mercado com o a redução dos efeitos da crise financeira mundial, em decorrência, houve aumento de 382,8% nas importações e redução de 3,5% nas exportações de fibras. A redução da produção mundial e o aumento da demanda ocasionou redução nos estoques de passagem, e manutenção dos preços em patamares elevados. No fim do exercício, o estoque de passagem era de 163,0 mil toneladas e os estoques públicos somaram apenas 37 toneladas, representando zero por cento do estoque de passagem e correspondendo a zero dias de consumo aparente.
2010;352;2170;Margem de Disponibilidade de Arroz em Casca;PERCENTAGEM;Anual;Nacional;Companhia Nacional de Abastecimento - CONAB;Relação percdentual entre a quantidade estocada de arroz em casca e o consumo aparente no ano de referência.;9.0;2003.0;0.0;6.0;11.0;0.0;0.0;0.0;0.0;0.0;0.0;0.0;0.0;0.0;0.0;0.0;A margem de disponibilidade de arroz em casca apurada em 2010 foi de 11%, superior à meta prevista (4%) em 175%. Na safra 2009/10 a produção de arroz atingiu 11,7 milhões de toneladas, inferior à anterior em 8,2% devido principalmente a fatores climáticos adversos ocorridos na Região Sul. O suprimento interno, compostos pelo total produzido mais o estoque inicial, ou seja, a quantidade residual do produto proveniente do período anterior, de 1,6 milhões de toneladas e às importações de 1,1 milhão de toneladas foi de 14,4 milhões de toneladas. Considerando a demanda estimada em 12,6 milhões de toneladas e as exportações realizadas durante o exercício de 400 mil toneladas, o estoque final foi de 4,4 milhões de toneladas, o menor dos 5 últimos anos. No fim do exercício, os estoques públicos somaram 981,3 mil toneladas, representando 85,85% do estoque de passagem correspondendo a 28,43 dias de consumo aparente.
2010;352;2171;Margem de Disponibilidade de Milho;PERCENTAGEM;Anual;Nacional;Companhia Nacional de Abastecimento - CONAB;Relação percentual entre a quantidade estocada de milho e o consumo aparente no ano de referência.;17.0;2003.0;0.0;18.0;24.0;0.0;0.0;0.0;0.0;0.0;0.0;0.0;0.0;0.0;0.0;0.0;A margem de disponibilidade de milho apurada em 2010 foi de 24% superando a meta prevista (17%) em 41,17%. O suprimento interno, formado pela quantidade produzida mais o estoque de passagem do ano anterior e as importações foi de 67,9 milhões de toneladas suficiente para a demanda (46,2 milhões de toneladas). O grande gargalo está relacionado à distribuição espacial da produção, que se concentra na região Centro-Sul, com 90% da produção, sem o amparo de infraestrutura de armazenagem suficiente, demandando grande logística na distribuição e apoio governamental no processo de comercialização. Favorecidas pela maior demanda mundial, por elevados preços internacionais e pelo aumento da produção interna as exportações somaram 10,5 milhões de toneladas, com incremento de 35,2% sobre as do ano anterior. No fim do exercício o estoque final foi de 11,1 milhões de toneladas e os estoques públicos somaram 4,7 milhões de toneladas, representando 42,07% do estoque de passagem e suficientes para 37,08 dias de consumo aparente.
2010;352;2172;Margem de Disponibilidade de Trigo;PERCENTAGEM;Anual;Nacional;Companhia Nacional de Abastecimento - CONAB;Relação percentual entre a quantidade estocada de trigo e o consumo aparente no ano de referência.;3.0;2004.0;0.0;3.0;24.0;0.0;0.0;0.0;0.0;0.0;0.0;0.0;0.0;0.0;0.0;0.0;A margem de disponibilidade de trigo apurada em 2010 foi de 24% superando a meta prevista (3%) em 800,%. O país não produz trigo suficiente para atender a demanda interna, praticamente 50% do consumo, ou seja, 5 milhões de toneladas são importadas do mercado internacional. Essa dependência coloca em risco não só o suprimento interno como nos deixa vulnerável a um processo de carestia, ocasionado por fatores externos. Na região Sul se concentram quase 94% da produção nacional de trigo. Na safra 2009/2010 a qualidade da semente utilizada, as técnicas de cultivo e a ocorrência de clima favorável para a cultura, contribuíram para que o produto colhido fosse de qualidade superior, adequada à panificação. Os estoques públicos no fim do exercício, somavam 1,2 milhão de toneladas, representando 84,72% do estoque de passagem, correspondente a 43 dias de consumo aparente.
2010;352;2760;Volume de Recursos Aplicados no Apoio à Comercialização de Produtos Agropecuários;R$ mil;Anual;Nacional;CONAB e Banco do Brasil;Recursos Orçamentários [(Valor Gasto com as AGF (somente valor das Aquisições) + Valor gasto com o Exercício de Contratos Públicos de Opção de Venda + Valor gasto na Garantia e Sustentação de Preços na Comercialização de Produtos Agropecuários)]+ Recursos Não Orçamentários [(Comercialização de Produtos Via Mercados Futuros e de Opções-BB Garantia de Preço)];3133029.0;2006.0;0.0;4271152.0;3402849.23;0.0;0.0;0.0;0.0;0.0;0.0;0.0;0.0;0.0;0.0;0.0;São os recursos orçamentários gastos na formação e manutenção dos estoques públicos, pelos prêmios de subvenção econômica de garantia e sustentação de preços na comercialização de produtos agropecuários adicionados aos recursos não-orçamentários na comercialização de produtos via mercados futuros e de opções. No ano de 2010 o valor aplicado foi de R$3.402.849.232,01, correspondente a 83,26% da meta prevista. Houve forte intervenção do governo federal em apoio aos produtores de milho, principalmente na Região Centro-Oeste. Também foram atendidos produtores de arroz, trigo e sisal, seja pela aquisição direta, via AGF, ou pela concessão de prêmios para escoamento da produção, viabilizando uma política de apoio para que o produtor tenha a garantia de preços mínimos.
2010;352;2761;Número de Produtores Rurais Atendidos pelos Instrumentos de Apoio à Comercialização de Produtos Agropecuários;UNIDADE;Anual;Nacional;CONAB;Soma do número de produtores atendidos por AGF, Contratos Públicos de Opção de Venda, Prêmio de Escoamento do Produto (PEP) + Prêmio de Risco de Opção Privada(PROP)+ Prêmio Equalizador da Soja - PESOJA + Prêmio Equalizador Pago ao Produtor - PEPRO.;11006.0;2006.0;0.0;17084.0;8104.0;0.0;0.0;0.0;0.0;0.0;0.0;0.0;0.0;0.0;0.0;0.0;O indicador tem por finalidade mostrar a quantidade de produtores rurais atendidos (pessoa física e jurídica) pelos instrumentos de apoio à comercialização disponíveis, tanto na Formação de Estoques Públicos(AGF e Contratos Públicos de Opção de Venda), como na Garantia e Sustentação de Preços (PEP e PEPRO). Em função da maior realização de leilões de concessão de prêmios em apoio à comercialização de produtos agrícolas no último semestre de 2010 grande parte das operações ainda não foram concluídas, motivo pelo qual não é possível mensurar o número de produtores atendidos na totalidade. Das operações realizadas em 2010 foram atendidos 8.104 produtores rurais (adquirentes/arrematantes) que utilizaram os instrumentos de apoio à comercialização disponíveis tanto na Formação de Estoques (AGF e Contratos de Opção), como na Garantia e Sustentação de Preços (PEP e PROP). À exceção do milho na Região Centro-Oeste e dos atendimentos aos produtores de arroz e trigo realizados no fim do exercício, o mercado agrícola permaneceu com preços equilibrados, o que acarretou a menor intervenção governamental e redução do número de produtores rurais que utilizaram os instrumentos de escoamento e abastecimento do Governo Federal.
2010;352;2762;Volume de Recursos Aplicados no Apoio à Produção de Produtos Agropecuários;R$ mil;Anual;Nacional;CONAB;O volume é dado por:  Total de crédito rural concedido pelas Instituições Financeiras que integram o Programa + Operações com Cédula do Produtor Rural - CPR.;11301553.0;2007.0;0.0;16639331.0;55839414.24;0.0;0.0;0.0;0.0;0.0;0.0;0.0;0.0;0.0;0.0;0.0;O montante de R$ 55.949.708.696,00 de recursos não-orçamentários concedidos por instituições financeiras oficiais de crédito (Banco do Brasil, Banco do Nordeste e Banco da Amazônia) direcionados ao agronegócio (setor agrícola, pecuária, e agroindústria), atendeu, principalmente, mutuários do Pronaf, mini e pequenos produtores, cooperativas e associações, cujos valores realizados superaram a previsão inicial em função da grande demanda por financiamentos e a disponibilidade de recursos para esse fim.
2010;352;327;Produção Nacional de Grãos;Milhão de t;Anual;Nacional;Companhia Nacional de Abastecimento - CONAB;Somatório da da quantidade total de grãos produzidos.;123.2;2004.0;0.0;150.0;149.0;0.0;0.0;0.0;0.0;0.0;0.0;0.0;0.0;0.0;0.0;0.0;A safra agrícola do ciclo 2009/10 estimada em 146,9 milhões de toneladas, foi superada em 1,4%, em relação à meta, tendo sido produzidas 149,0 milhões, conforme o resultado indicado nas pesquisas de safra realizadas pela Conab. Esse aumento deveu-se às boas condições climáticas verificadas nas principais regiões produtoras que favoreceu o desenvolvimento das lavouras, principalmente a soja e o milho 2.ª safra, com incremento de 20,2% e 27,1% sobre a safra anterior. No mesmo comparativo, a região Centro-Sul apresentou um crescimento de 11,23% e a Norte/Nordeste de 3,3%.
