Ano;Programa;Identificador_Unico;Descricao;Unidade_Medida;Periodicidade;Base_Geografica;Fonte;Fórmula_Calculo;Valor_Referencia;Data_Referencia;Valor_Final_PPA;Valor_Previsto_no_Ano;Periodo_01;Periodo_02;Periodo_03;Periodo_04;Periodo_05;Periodo_06;Periodo_07;Periodo_08;Periodo_09;Periodo_10;Periodo_11;Periodo_12;Comentarios
2010;777;581;Grau de Satisfação dos Alunos;PERCENTAGEM;Anual;Nacional;ESAF;Média aritmética das notas atribuídas pelos alunos em questionário padrão.;76.0;1999.0;0.0;90.0;93.93;0.0;0.0;0.0;0.0;0.0;0.0;0.0;0.0;0.0;0.0;0.0;Indicador obtido do SIGEP, conm base nos relatórios pedagógicos e financeiros concluídos até dezembro de 2010, com a devida avaliação do participante.
2010;777;582;Grau de Satisfação dos Contratantes;PERCENTAGEM;Anual;Nacional;ESAF;Média aritmética de várias notas atribuídas pelos contratantes em questionário padrão;85.0;1999.0;0.0;95.0;97.03;0.0;0.0;0.0;0.0;0.0;0.0;0.0;0.0;0.0;0.0;0.0;Indicador obtido do SIGEP, conm base nos relatórios pedagógicos e financeiros concluídos até dezembro de 2010, com a devida avaliação dos contratantes registradas.
2010;778;583;Taxa de Emissões Primárias da Economia;PERCENTAGEM;Anual;Nacional;CVM e IBGE;Relação percentual entre o total de emissões primárias, públicas e particulares, realizadas via mercado de valores mobiliários e o investimento total da economia.;9.7;2002.0;0.0;14.31;30.8;0.0;0.0;0.0;0.0;0.0;0.0;0.0;0.0;0.0;0.0;0.0;Não Informado
2010;778;584;Taxa de Participação das Companhias Abertas Listadas em Bolsa e em Balcão Organizado no Produto Interno Bruto (PIB);PERCENTAGEM;Anual;Nacional;Bolsa de Valores, Mercado de Balcão Organizado e IBGE;Relação percentual entre o valor total de mercado das companhias abertas listadas em bolsa e em balcão organizado e o Produto Interno Bruto - PIB.;34.0;2002.0;0.0;75.23;69.92;0.0;0.0;0.0;0.0;0.0;0.0;0.0;0.0;0.0;0.0;0.0;Não Informado
2010;778;586;Número de Acessos à Home-Page da Comissão de Valores Mobiliários (CVM);UNIDADE;Anual;Nacional;CVM;Somatório do nº de acessos externos à Home-Page da CVM no ano.;2604935.0;2002.0;0.0;3172350.0;3601169.0;0.0;0.0;0.0;0.0;0.0;0.0;0.0;0.0;0.0;0.0;0.0;Não Informado
2010;779;587;Empresas dos Mercados de Seguros, Previdência Complementar Aberta e Capitalização Alinhadas Com as Regras de Capital Baseado em Risco de Subscrição;PERCENTAGEM;Anual;Nacional;SUSEP;Relação Percentual entre as Empresas Alinhadas Totalmente com as Regras de Capital Baseado em Risco de Subscrição e o Total de Empresas dos Mercados de Seguros, Previdência Complementar Aberta e Capitalização, no ano.;1.85;2003.0;0.0;89.4;91.96;0.0;0.0;0.0;0.0;0.0;0.0;0.0;0.0;0.0;0.0;0.0;A data de apuração deste índice de referência é 31 de março.
2010;779;588;Taxa de Participação das Reservas dos Mercados de Seguros, Previdência Complementar Aberta e Capitalização no Produto Interno Bruto(PIB);PERCENTAGEM;Anual;Nacional;SUSEP;Relação percentual entre as Reservas dos Mercados de Seguros, Previdência Complementar Aberta e Capitalização e o Produto Interno Bruto - PIB, no ano.;0.42;2003.0;0.0;3.2;7.77;0.0;0.0;0.0;0.0;0.0;0.0;0.0;0.0;0.0;0.0;0.0;A data de apuração deste índice de referência é 31 de março.
2010;779;589;Taxa de Participação da População Nacional nas Receitas dos Mercados de Seguros, Previdência Complementar Aberta e Capitalização;R$ per capita;Anual;Nacional;SUSEP;Relação percentual entre o Total das Receitas dos Mercados de Seguros, Previdência Complementar Aberta e Capitalização (que é igual ao acumulado dos prêmios/contribuições dos mercados de seguros, previdência complementar aberta e capitalização recolhidos), no ano, e a população nacional estimada a cada ano pelo IBGE.;0.55;2003.0;0.0;522.77;593.8;0.0;0.0;0.0;0.0;0.0;0.0;0.0;0.0;0.0;0.0;0.0;A data de apuração deste índice de referência é 31 de março.
2010;781;1958;Taxa de Variação das Transações das Instituições Financeiras Oficiais;%;Anual;Nacional;Bancos Federais;"(Transações por diversos canais) - (Transações via ""boca"" do Caixa) / Transações totais do Banco";0.0;0.0;0.0;92.43;93.18;0.0;0.0;0.0;0.0;0.0;0.0;0.0;0.0;0.0;0.0;0.0;Não Informado
2010;794;2786;Taxa de Crescimento da Arrecadação Patrimonial;%;Anual;Nacional;Não Informado;[Valor total da arrecadação patrimonial do exercício/Valor total da arrecadação do ano-base] x 100.;100.0;2006.0;0.0;146.29;243.09;0.0;0.0;0.0;0.0;0.0;0.0;0.0;0.0;0.0;0.0;0.0;
2010;796;30;Taxa de Satisfação do Usuário;PERCENTAGEM;Anual;Nacional;IBGE;Relação percentual entre a média das notas dadas pelos usuários quanto à qualidade das informações prestadas e a média das notas dadas pelos usuários quanto às suas expectativas quanto ao serviço prestado, onde valores abaixo de 100 indicam insatisfação e maiores ou igual a 100 indicam satisfação.;117.63;2008.0;0.0;117.0;116.14;0.0;0.0;0.0;0.0;0.0;0.0;0.0;0.0;0.0;0.0;0.0;O índice apurado demonstra que o IBGE vem oferecendo serviços com qualidade acima das expectativas dos usuários.
2010;797;2759;Taxa de Crescimento dos Acessos aos Sites do IPEA (proxy de avaliação pela sociedade);PERCENTAGEM;Anual;Nacional;IPEA/MP;Esse indicador é atualmente captado pela taxa de variação do número de acessos aos sites do IPEA, IpeaData, Revista Desafios e Estado de uma Nação, na internet. Para tal, considera-se o número de visitas aos sites (sessões), parâmetro mais comumente usado para determinar o número de usuários que acessam o site em um determinado período. Fórmula de cálculo:    {[(V1 / V1a) - 1] + [(V2 / V2a) -1] + [(V3 / V3a) -1] + [(V4 / V4a) - 1]} / 4  Onde:   V1 = número de visitas ao site do IPEA, na internet, no ano considerado pelo relatório  V2 = número de visitas ao site da publicação Brasil: o estado de uma nação, na internet, no ano considerado pelo relatório  V3 = número de visitas ao site do IpeaData, na internet, no ano considerado pelo relatório  V4 = número de visitas ao site da Revista Desafios do Desenvolvimento, na internet, no ano considerado pelo relatório  V1a = número de visitas ao site do IPEA, na internet, no ano anterior ao considerado pelo relatório  V2a = número de visitas ao site da publicação Brasil: o estado de uma nação, na internet, no ano anterior ao considerado pelo relatório  V3a = número de visitas ao site do IpeaData, na internet, no ano anterior ao considerado pelo relatório  V4a = número de visitas ao site da Revista Desafios do Desenvolvimento, na internet, no ano anterior ao considerado pelo relatório;1.0;2007.0;0.0;3.0;1.55;0.0;0.0;0.0;0.0;0.0;0.0;0.0;0.0;0.0;0.0;0.0;Indicador Anual. O indicador foi 1,548 maior que o acessos de 2009. Entretanto, se observarmos no início do PPA 2008 em relação a 2010 podemos afirmar que praticamente atingiu a sua meta alcançando o valor de 2,905.
2010;801;2690;Número de Horas  de Capacitação Realizadas;Hora;Anual;Nacional;Escola Nacional de Administração Pública/ ENAP;Soma total da carga horária realizada por participantes dos eventos de aprendizagem durante o ano.;576047.0;2006.0;0.0;570000.0;1039036.0;0.0;0.0;0.0;0.0;0.0;0.0;0.0;0.0;0.0;0.0;0.0;
2010;801;2691;Número de Capacitações Realizadas;UNIDADE;Anual;Nacional;Escola Nacional de Administração Pública/ ENAP;Soma total de participantes nos eventos de aprendizgem durante o ano.;20379.0;2006.0;0.0;21500.0;36755.0;0.0;0.0;0.0;0.0;0.0;0.0;0.0;0.0;0.0;0.0;0.0;
2010;801;2692;Número de Capacitações Realizadas por meio de Destaques Orçamentários;UNIDADE;Anual;Nacional;Escola Nacional de Administração Pública/ ENAP;Soma total de participantes nos eventos de aprendizagem realizados por meio de destaques orçamentários durante o ano.;2230.0;2006.0;0.0;2300.0;2342.0;0.0;0.0;0.0;0.0;0.0;0.0;0.0;0.0;0.0;0.0;0.0;
2010;801;2693;Número de Downloads Realizados no Sítio da ENAP;UNIDADE;Anual;Nacional;Escola Nacional de Administração Pública/ ENAP;Soma total dos downloads das seguintes publicações da ENAP: cadernos, livros, revistas, textos para discussão, seminários e catálogo de cursos.;101896.0;2006.0;0.0;115000.0;226000.0;0.0;0.0;0.0;0.0;0.0;0.0;0.0;0.0;0.0;0.0;0.0;
2010;810;2580;Taxa de Empresas Avaliadas no SiAC;porcentagem (%);Anual;Nacional;Banco de Dados PBQP-H - Lista de empresas avaliadas (portal: www.cidades.gov.br/pbqp-h)Banco de Dados do INMETRO IBGE;Relação entre o número de empresas de serviços e obras avaliadas no SiAC/PBQP-H (Sistema de Avaliação da Conformidade de Serviços e Obras) e o número total de empresas na(s) mesma(s) especialidade(s) técnica(s) no País.;3.4;2006.0;0.0;7.3;8.77;0.0;0.0;0.0;0.0;0.0;0.0;0.0;0.0;0.0;0.0;0.0;Em 21 de dezembro, o SiAC atingiu o número de 2.544 empresas participantes do Sistema de Avaliação da Conformidade de Empresas de Serviços e Obras. Este número corresponde a aproximadamente 8,77% do número total de construtoras com mais de quatro pessoas ocupadas, conforme o PAIC do IBGE.
2010;810;2581;Índice de Qualificação de Materiais e Componentes da Cesta Básica da Construção Civil;porcentagem;Anual;Nacional;Banco de Dados do PBQP-H - Lista de PSQs (portal: www.cidades.gov.br/pbqp-h)Entidade setorial de cada produto;Média dos índices de conformidade dos PSQs (Programas Setoriais da Qualidade) com indicador constantemente calculado e monitorado.;84.0;2007.0;0.0;88.0;81.34;0.0;0.0;0.0;0.0;0.0;0.0;0.0;0.0;0.0;0.0;0.0;O índice apurado da conformidade dos materiais da cesta básica da construção civil, referente a média dos índices de conformidade dos Programas Setoriais da Qualidade (PSQs  SiMAC) ativos, apresentou uma valor inferior ao índice previsto para 2010, em função de 6 PSQs não terem atualizados os indicadores de conformidade no 4º trimestre.
2010;812;2614;Taxa de Variação Líquida das Exportações da Indústria;percentual;Anual;Nacional;BACEN e SECEX;"- A/B, onde A = taxa de variação média do valor em dólar das exportações da indústria e B = módulo da taxa de variação média do câmbio do real com o dólar americano.  - Cálculo de A: X = total anual de exportações da indústria no ano atual; E = total anua";1.88;2007.0;0.0;2.63;1.94;0.0;0.0;0.0;0.0;0.0;0.0;0.0;0.0;0.0;0.0;0.0;Houve um grande avanço no ano de 2010, em relação a 2009: crescimento de 22,9 % nas exportações. Entretanto, houve uma grande variação do real em relação ao dólar americano: 11,8%. Assim, a Taxa de Variação Líquida das Exportações é impactada por essa variação cambial, fazendo com que a Taxa chegasse apenas a 1,94 (22,9/11,8)
2010;813;1725;Taxa de Centros Históricos Conservados de Forma Sustentável;PERCENTAGEM;Anual;Nacional;Ministério da Cultura;Relação percentual entre a quantidade de monumentos conservados de forma sustentável nos centros urbanos selecionados e o total de monumentos identificados pelo Programa nestes centros;47.33;2006.0;0.0;0.0;88.1;0.0;0.0;0.0;0.0;0.0;0.0;0.0;0.0;0.0;0.0;0.0;
2010;1008;2729;Taxa de acesso individual à internet nos últimos 3 meses;%;Anual;Nacional;Pesquisa TIC Domicílios e Usuários/ Conselho Gestor da Internet Brasil - CGI.Br;Percentual sobre o total de respondentes que utilizaram a internet nos últimos 3 meses.;27.82;2006.0;0.0;48.9;0.0;0.0;0.0;0.0;0.0;0.0;0.0;0.0;0.0;0.0;0.0;0.0;Não Informado
2010;1009;1093;Taxa de Variação da Necessidade de Financiamento dos Regimes Próprios de Previdência;PERCENTAGEM;Anual;Estadual;Demonstrativos Previdenciários da União, Estados, Municípios e Distrito Federal;Variação percentual do valor da necessidade de financiamento dos regimes próprios de previdência da União, Estados, Municípios e Distrito Federal no ano corrente e o valor da necessidade de financiamento do ano anterior.;4.5;2003.0;0.0;2.4;2.5;0.0;0.0;0.0;0.0;0.0;0.0;0.0;0.0;0.0;0.0;0.0;Considerando que os Estados concederam aumentos significativos aos seus servidores e que a regra de reajuste dos beneficios dos inativos é a da paridade. Isto fez com que a despesa de inativos tivesse um incremento signficativo em 2010 e o indice apurado atingiu o previsto para 2010, com um pequeno incremento em relação ao ano anterior
2010;1016;2242;Taxa de Variação da Renda dos Artesãos Cadastrados nos Órgãos Estaduais Competentes;número índice;Anual;Nacional;MDIC;Relação percentual entre a renda dos artesãos cadastrados na Coordenação Estadual do programa no ano e a renda destes artesãos no ano anterior.;100.0;2007.0;0.0;0.0;0.0;0.0;0.0;0.0;0.0;0.0;0.0;0.0;0.0;0.0;0.0;0.0;Não Informado
2010;1020;806;Taxa de Participação do PIB Regional na Composição do PIB Nacional;PERCENTAGEM;Anual;Regional;IBGE;Relação percentual entre o valor do Produto Interno Bruto (PIB) da Amazônia Ocidental, excluindo-se o valor do PIB do Pólo Industrial de Manaus, e o valor do PIB Nacional.;1.75;2006.0;0.0;1.8;2.05;0.0;0.0;0.0;0.0;0.0;0.0;0.0;0.0;0.0;0.0;0.0;
2010;1025;2207;Número de Ocupações Geradas na Sub-região da Bacia do Itabapoana;UNIDADE;Anual;Municipal;CAGED/MTE e SPR/MI;Somatório do nº de ocupações (formal + informal) gerados na Sub-região da Bacia do Itabapoana nos arranjos produtivos apoiados pelo programa.;0.0;0.0;0.0;0.0;0.0;0.0;0.0;0.0;0.0;0.0;0.0;0.0;0.0;0.0;0.0;0.0;Não Informado
2010;1025;2208;Número de Ocupações Geradas na Sub-região da Chapada das Mangabeiras;UNIDADE;Anual;Municipal;CAGED/MTE e SPR/MI;Somatório do nº de ocupações (formal + informal) gerados na Sub-região da Chapada das Mangabeiras nos arranjos produtivos apoiados pelo programa.;0.0;0.0;0.0;0.0;0.0;0.0;0.0;0.0;0.0;0.0;0.0;0.0;0.0;0.0;0.0;0.0;Não Informado
2010;1025;2209;Número de Ocupações Geradas na Sub-região da Chapada do Araripe;UNIDADE;Anual;Municipal;CAGED/MTE e SPR/MI;Somatório do nº de ocupações (formal + informal) gerados na na Sub-região da Chapada do Araripe nos arranjos produtivos apoiados pelo programa.;0.0;0.0;0.0;0.0;0.0;0.0;0.0;0.0;0.0;0.0;0.0;0.0;0.0;0.0;0.0;0.0;Não Informado
2010;1025;2210;Número de Ocupações Geradas na Sub-região da Metade Sul do Rio Grande do Sul;UNIDADE;Anual;Municipal;CAGED/MTE e SPR/MI;Somatório do nº de ocupações (formal + informal) gerados na Sub-região da Metade Sul do Rio Grande do Sul nos arranjos produtivos apoiados pelo programa.;0.0;0.0;0.0;0.0;0.0;0.0;0.0;0.0;0.0;0.0;0.0;0.0;0.0;0.0;0.0;0.0;Não Informado
2010;1025;2212;Número de Ocupações Geradas na Sub-região de Águas Emendadas;UNIDADE;Anual;Municipal;CAGED/MTE e SPR/MI;Somatório do nº de ocupações (formal + informal) gerados na  na Sub-região de Águas Emendadas nos arranjos produtivos apoiados pelo programa.;0.0;0.0;0.0;0.0;0.0;0.0;0.0;0.0;0.0;0.0;0.0;0.0;0.0;0.0;0.0;0.0;Não Informado
2010;1025;2213;Número de Ocupações Geradas na Sub-região do Alto Solimões;UNIDADE;Anual;Municipal;CAGED/MTE e SPR/MI;Somatório do nº de ocupações (formal + informal) gerados na Sub-região do Alto Solimões nos arranjos produtivos apoiados pelo programa.;0.0;0.0;0.0;0.0;0.0;0.0;0.0;0.0;0.0;0.0;0.0;0.0;0.0;0.0;0.0;0.0;Não Informado
2010;1025;2214;Número de Ocupações na Sub-região do Bico do Papagaio;UNIDADE;Anual;Municipal;CAGED/MTE e SPR/MI;Somatório do nº de ocupações (formal + informal) gerados na Sub-região do Bico do Papagaionos arranjos produtivos apoiados pelo programa.;0.0;0.0;0.0;0.0;0.0;0.0;0.0;0.0;0.0;0.0;0.0;0.0;0.0;0.0;0.0;0.0;Não Informado
2010;1025;2215;Número de Ocupações na Sub-região do Vale do Ribeira e Guaraqueçaba;UNIDADE;Anual;Municipal;CAGED/MTE e SPR/MI;Somatório do nº de ocupações (formal + informal) gerados na Sub-região do Vale do Ribeira e Guaraqueçaba nos arranjos produtivos apoiados pelo programa.;0.0;0.0;0.0;0.0;0.0;0.0;0.0;0.0;0.0;0.0;0.0;0.0;0.0;0.0;0.0;0.0;Não Informado
2010;1025;2216;Número de Ocupações na Sub-região do Vale do Jequitinhonha e Mucuri;UNIDADE;Anual;Municipal;IBGE e SPR/MI;Somatório do nº de ocupações (formal + informal) gerados na Sub-região do Vale do Jequitinhonha e Mucuri nos arranjos produtivos apoiados pelo programa.;0.0;0.0;0.0;0.0;0.0;0.0;0.0;0.0;0.0;0.0;0.0;0.0;0.0;0.0;0.0;0.0;Não Informado
2010;1025;2217;Número de Ocupações na Sub-região do Vale do Rio Acre;UNIDADE;Anual;Municipal;CAGED/MTE e SPR/MI;Somatório do nº de ocupações (formal + informal) gerados na na Sub-região do Vale do Rio Acre nos arranjos produtivos apoiados pelo programa.;0.0;0.0;0.0;0.0;0.0;0.0;0.0;0.0;0.0;0.0;0.0;0.0;0.0;0.0;0.0;0.0;Não Informado
2010;1025;2218;Número de Ocupações Geradas na Sub-região do Xingó;UNIDADE;Anual;Municipal;CAGED/MTE e SPR/MI;Somatório do nº de ocupações (formal + informal) gerados na Sub-região do Xingó nos arranjos produtivos apoiados pelo programa.;0.0;0.0;0.0;0.0;0.0;0.0;0.0;0.0;0.0;0.0;0.0;0.0;0.0;0.0;0.0;0.0;Não Informado
2010;1025;2219;Número de Ocupações Geradas na Região Integrada do DF e Entorno;UNIDADE;Anual;Municipal;CAGED/MTE e SPR/MI;Somatório do nº de ocupações (formal + informal) gerados na RIDE-DF nos arranjos produtivos apoiados pelo programa;0.0;0.0;0.0;0.0;0.0;0.0;0.0;0.0;0.0;0.0;0.0;0.0;0.0;0.0;0.0;0.0;Não Informado
2010;1025;2239;Número de Ocupações Geradas na Sub-região da Grande Fronteira do Mercosul;UNIDADE;Anual;Municipal;CAGED/MTE e SPR/MI;Somatório do nº de ocupações (formal + informal) gerados na na Sub-região da Grande Fronteira do Mercosul nos arranjos produtivos apoiados pelo programa.;0.0;0.0;0.0;0.0;0.0;0.0;0.0;0.0;0.0;0.0;0.0;0.0;0.0;0.0;0.0;0.0;Não Informado
2010;1027;744;Taxa de Municípios Preparados para Prevenção e Atendimento a Desastres;PERCENTAGEM;Anual;Nacional;Órgãos Estaduais de Defesa Civil;Relação percentual entre o número de municípios com órgãos de defesa civil comprovadamente em funcionamento e o total de municípios brasileiros.;62.0;2004.0;0.0;0.0;0.0;0.0;0.0;0.0;0.0;0.0;0.0;0.0;0.0;0.0;0.0;0.0;Não Informado
2010;1029;760;Taxa de Resposta aos Desabrigados e Desalojados nos Municípios em Emergência ou Estado de Calamidade Pública;PERCENTAGEM;Anual;Nacional;SEDEC/MI e Órgãos Estaduais de Defesa Civil;Relação percentual entre o nº de desabrigados e desalojados atendidos pelo programa nos desastres em municípios na situação de emergência e/ou de estado de calamidade pública reconhecidos pelo Governo Federal e nº total de desalojados e desabrigados em desastres nesses municípios.;40.0;2004.0;0.0;0.0;0.0;0.0;0.0;0.0;0.0;0.0;0.0;0.0;0.0;0.0;0.0;0.0;Não Informado
2010;1030;109;Evolução do Atendimento a Demanda de Acesso à Informação pelos Cidadãos e Órgãos Públicos;porcentagem (%);Não Informado;Não Informado;Não Informado;;100.0;2007.0;0.0;0.0;41.61;0.0;0.0;0.0;0.0;0.0;0.0;0.0;0.0;0.0;0.0;0.0;Não Informado
2010;1032;2441;Total de Matérias Jornalísticas;UNIDADE;Anual;Nacional;Empresa Brasil de Comunicação SA - EBC;Somatório de matérias produzidas e veiculadas por todos os veículos da EBC: rádios (Nacional AM, Nacional FM, Nacional OC, Nacional do Rio de Janeiro e Radioagência), tvs (NBR e Nacional) e a Agência Brasil.;181585.0;2005.0;0.0;0.0;547163.0;0.0;0.0;0.0;0.0;0.0;0.0;0.0;0.0;0.0;0.0;0.0;No final do exercício de 2010, foram distribuidas 547.163 matérias, atingindo 36,36% acima do previsto para o ano.
2010;1032;2442;Transmissão de Eventos da Presidência da República;%;Anual;Nacional;Empresa Brasil de Comunicação SA - EBC;Percentual da relação entre o número de eventos transmitidos e o número de eventos programados pela Presidência da República.;100.0;2004.0;0.0;0.0;100.0;0.0;0.0;0.0;0.0;0.0;0.0;0.0;0.0;0.0;0.0;0.0;A EBC transmitiu 100% dos eventos com a participação do Presidente da República, tanto realizados em Brasília, como em outros estados e no exterior, pelo canal NBR, cumprindo rigorosamente a meta prevista, com a transmissão de 407 eventos ao longo de 2010.
2010;1036;799;Vazão Média de Água nas Bacias Beneficiadas pela Integração;m³/s;Anual;Nacional;SIH/MI;Vazão média de água nas bacias beneficiadas pela integração das águas por segundo.;75.0;2003.0;0.0;0.0;0.0;0.0;0.0;0.0;0.0;0.0;0.0;0.0;0.0;0.0;0.0;0.0;Não Informado
2010;1042;2675;Acréscimo de Capacidade Instalada de Geração de Energia Elétrica;MW;Anual;Regional;CMSE - Comitê de Monitoramento do Setor Elétrico;ampliação anual das linhas de transmissão de energia elétrica com tensão igual ou superior a 230 kV;0.0;2007.0;0.0;240.0;90.0;0.0;0.0;0.0;0.0;0.0;0.0;0.0;0.0;0.0;0.0;0.0;Não Informado
2010;1042;2676;Índice de Perdas Técnicas e Comerciais das Empresas Federalizadas nos Sistemas Isolados;%;Anual;Regional;ELETROBRÁS;Produção de Energia Elétrica (MWh) - Faturamento de Energia Elétrica (MWh) / Produção de Energia Elétrica (MWh) * 100                                   (empresas federalizadas dos sistemas isolados);29.89;2007.0;0.0;21.46;0.0;0.0;0.0;0.0;0.0;0.0;0.0;0.0;0.0;0.0;0.0;0.0;Não Informado
2010;1042;2716;Acréscimo de Linhas de Transmissão de Energia Elétrica com Tensão Igual ou Superior a 230 Kv;km;Anual;Regional;CMSE - Comitê de Monitoramento do Setor Elétrico;Ampliação anual de linhas de transmissão de energia elétrica, com tensão igual ou superior a 230 kv.;0.0;2007.0;0.0;0.0;0.0;0.0;0.0;0.0;0.0;0.0;0.0;0.0;0.0;0.0;0.0;0.0;Não Informado
2010;1044;1016;Taxa de Participação de Energias Alternativas Renováveis na Matriz Energética;PERCENTAGEM;Anual;Nacional;MME;Porcentagem de FARs na matriz energética = Potência Instalada de FARs (Mw) / Potência Total Instalada (Mw).;0.91;2007.0;0.0;1.1;0.0;0.0;0.0;0.0;0.0;0.0;0.0;0.0;0.0;0.0;0.0;0.0;Para o cálculo do indicador são necessários dados dísponíveis no Balanço Energético Nacional (BEN), ano 2011, base 2010. Este Balanço ainda não foi concluído devido à complexidade da aquisição de dados e sua análise.
2010;1044;2529;Taxa de Participação de Energias Alternativas Renováveis na Matriz Elétrica;%;Anual;Nacional;Ministério de Minas e Energia - MME;Porcentagem de FARs na matriz elétrica = Potência Instalada de FARs (Mw) / Potência Total Instalada (Mw);3.0;2004.0;0.0;0.0;0.0;0.0;0.0;0.0;0.0;0.0;0.0;0.0;0.0;0.0;0.0;0.0;Para o cálculo do indicador são necessários dados dísponíveis no Balanço Energético Nacional (BEN), ano 2011, base 2010. Este Balanço ainda não foi concluído devido à complexidade da aquisição de dados e sua análise.
2010;1045;2189;Capacidade da rede de dutos para o transporte de gás natural;milhão de m³ por dia;Anual;Nacional;Petrobras;É o somatório da capacidade diária de transporte de cada duto, medido em milhões de m³.;7870.0;2003.0;0.0;0.0;60.0;0.0;0.0;0.0;0.0;0.0;0.0;0.0;0.0;0.0;0.0;0.0;Não Informado
2010;1045;2427;Extensão da malha de gasodutos da Petrobras;km;Anual;Nacional;Petrobras Transporte S.A.;Somatório da extensão dos gasodutos de transporte do Sistema Petrobras em quilometros;6511.0;2007.0;0.0;9621.0;9719.0;0.0;0.0;0.0;0.0;0.0;0.0;0.0;0.0;0.0;0.0;0.0;Não Informado
2010;1045;839;Volume de Vendas de Gás Natural no Brasil;milhões de m3/dia;Anual;Nacional;Petrobras - Unidade de Gás Natural;Volume médio diário em milhões de metros cúbicos, de gás natural comercializado (não considera consumo interno no sistema Petrobras), em território nacional pela Petrobras.;23.8;2002.0;0.0;0.0;49.5;0.0;0.0;0.0;0.0;0.0;0.0;0.0;0.0;0.0;0.0;0.0;Não Informado
2010;1046;1927;Energia Elétrica Economizada;GWh;Anual;Nacional;Ministério de Minas e Energia/Secretaria de Energia e Secretaria Executiva do PROCEL;Somatório das estimativas de energia  economizada em todos os setores da economia decorrentes das ações do programa.;1270.0;2003.0;0.0;3550.0;0.0;0.0;0.0;0.0;0.0;0.0;0.0;0.0;0.0;0.0;0.0;0.0;"Os resultados dos indicadores utilizados não são passíveis de apuração no mesmo ano, uma vez que envolve o tratamento de uma grande massa de dados, entre eles, de mercado, e requerem uma análise acurada. Por conta disso, ao final do ano são conseguidos os resultados do ano anterior. Para o indicador (1), tem-se:
2005 = 2.158 GWh; 2006 = 2.845 GWh; 2007 = 3.930 GWh; 2008 = 4.374 GWh; 2009 = 5.473 GWh. Isso nos permite inferir que o índice previsto no período de 2010 foi plenamente atingido três anos antes."
2010;1046;1928;Quantidade de Petróleo Conservada;m³;Anual;Nacional;Ministério de Minas e Energia/Secretaria de Energia e Secretaria Executiva do CONPET;Somatório das estimativas de óleo diesel economizados em todos os setores da economia decorrentes das ações do programa.;280000.0;2006.0;0.0;550000.0;0.0;0.0;0.0;0.0;0.0;0.0;0.0;0.0;0.0;0.0;0.0;0.0;"Os resultados dos indicadores utilizados não são passíveis de apuração no mesmo ano, uma vez que envolve o tratamento de uma grande massa de dados, entre eles, de mercado, e requerem uma análise acurada. Por conta disso, ao final do ano são conseguidos os resultados do ano anterior. Para o indicador (2), tem-se os valores referentes ao aumento de eficiência do uso de GLP nos fogões a gás,  transformado em m³ de Diesel:
2005 = 764.454 m³; 2006 = 764.173 m³; 2007 = 805.405 m³; 2008 = 465.473 m³; 2009 = 462.071 m³. A diminuição dos resultados obtidos ano a ano é reflexo de metodologia do CONPET que compara os resultados com a média do mercado. Ano a ano a média de consumo tem diminuído, fruto da maior penetração de equipamentos eficientes."
2010;1047;8100;Taxa de Internação de Pessoas com Doenças Infecciosas e Parasitárias na Região do Semi-Árido;%;Anual;Regional;Ministério da Saúde/SE/Datasus - Sistema de Informações Hospitalares do SUS - SIH/SUS;Relação percentual entre a população servida com rede geral de abastecimento de água nos estados componentes da região do semi-árido e o total da população existente nessa região, excluídas as regiões metropolitanas.;14.5;2001.0;0.0;0.0;0.0;0.0;0.0;0.0;0.0;0.0;0.0;0.0;0.0;0.0;0.0;0.0;Não Informado
